<?xml version="1.0" encoding="UTF-8"?>
<l:language xmlns:l="http://cedric.bosdonnat.free.fr/coooder/language/"    xmlns:xsi="http://www.w3.org/2001/XMLSchema-instance"    xsi:schemaLocation="http://cedric.bosdonnat.free.fr/coooder/language/ language.xsd " 	id="csharp" name="C#" objectOriented="true" escapeChar="\"><l:objectSplitters><l:splitter id="splitter_1" value="."/><l:splitter id="splitter_2" value="::"/></l:objectSplitters><l:comments caseSensitive="false"><l:single id="comments_1"><l:opening>//</l:opening></l:single><l:single id="comments_2"><l:opening>#</l:opening></l:single><l:multiple><l:opening>/*</l:opening><l:closing>*/</l:closing></l:multiple></l:comments><l:symbols><l:set id="symbols_0"><l:value>+</l:value><l:value>-</l:value><l:value>*</l:value><l:value>?</l:value><l:value>=</l:value><l:value>/</l:value><l:value>%</l:value><l:value>&amp;</l:value><l:value>&gt;</l:value><l:value>&lt;</l:value><l:value>^</l:value><l:value>!</l:value><l:value>:</l:value><l:value>;</l:value><l:value>(</l:value><l:value>)</l:value><l:value>{</l:value><l:value>}</l:value><l:value>[</l:value><l:value>]</l:value><l:value>|</l:value></l:set></l:symbols><l:quotemarks><l:value>'</l:value><l:value>&quot;</l:value></l:quotemarks><l:hardquotes><l:value>@&quot;</l:value><l:value>&quot;</l:value></l:hardquotes><l:hardquoteEscapes><l:value>&quot;&quot;</l:value></l:hardquoteEscapes><l:keywords><l:set id="keywords_1" caseSensitive="false"><l:value>as</l:value><l:value>auto</l:value><l:value>base</l:value><l:value>break</l:value><l:value>case</l:value><l:value>catch</l:value><l:value>const</l:value><l:value>continue</l:value><l:value>default</l:value><l:value>do</l:value><l:value>else</l:value><l:value>event</l:value><l:value>explicit</l:value><l:value>extern</l:value><l:value>false</l:value><l:value>finally</l:value><l:value>fixed</l:value><l:value>for</l:value><l:value>foreach</l:value><l:value>goto</l:value><l:value>if</l:value><l:value>implicit</l:value><l:value>in</l:value><l:value>internal</l:value><l:value>lock</l:value><l:value>namespace</l:value><l:value>null</l:value><l:value>operator</l:value><l:value>out</l:value><l:value>override</l:value><l:value>params</l:value><l:value>private</l:value><l:value>protected</l:value><l:value>public</l:value><l:value>readonly</l:value><l:value>ref</l:value><l:value>return</l:value><l:value>sealed</l:value><l:value>stackalloc</l:value><l:value>static</l:value><l:value>switch</l:value><l:value>this</l:value><l:value>throw</l:value><l:value>true</l:value><l:value>try</l:value><l:value>unsafe</l:value><l:value>using</l:value><l:value>virtual</l:value><l:value>void</l:value><l:value>while</l:value></l:set><l:set id="keywords_2" caseSensitive="false"><l:value>#elif</l:value><l:value>#endif</l:value><l:value>#endregion</l:value><l:value>#else</l:value><l:value>#error</l:value><l:value>#define</l:value><l:value>#if</l:value><l:value>#line</l:value><l:value>#region</l:value><l:value>#undef</l:value><l:value>#warning</l:value></l:set><l:set id="keywords_3" caseSensitive="false"><l:value>checked</l:value><l:value>is</l:value><l:value>new</l:value><l:value>sizeof</l:value><l:value>typeof</l:value><l:value>unchecked</l:value></l:set><l:set id="keywords_4" caseSensitive="false"><l:value>bool</l:value><l:value>byte</l:value><l:value>char</l:value><l:value>class</l:value><l:value>decimal</l:value><l:value>delegate</l:value><l:value>double</l:value><l:value>enum</l:value><l:value>float</l:value><l:value>int</l:value><l:value>interface</l:value><l:value>long</l:value><l:value>object</l:value><l:value>sbyte</l:value><l:value>short</l:value><l:value>string</l:value><l:value>struct</l:value><l:value>uint</l:value><l:value>ulong</l:value><l:value>ushort</l:value></l:set><l:set id="keywords_5" caseSensitive="false"><l:value>Microsoft.Win32</l:value><l:value>System</l:value><l:value>System.CodeDOM</l:value><l:value>System.CodeDOM.Compiler</l:value><l:value>System.Collections</l:value><l:value>System.Collections.Bases</l:value><l:value>System.ComponentModel</l:value><l:value>System.ComponentModel.Design</l:value><l:value>System.ComponentModel.Design.CodeModel</l:value><l:value>System.Configuration</l:value><l:value>System.Configuration.Assemblies</l:value><l:value>System.Configuration.Core</l:value><l:value>System.Configuration.Install</l:value><l:value>System.Configuration.Interceptors</l:value><l:value>System.Configuration.Schema</l:value><l:value>System.Configuration.Web</l:value><l:value>System.Core</l:value><l:value>System.Data</l:value><l:value>System.Data.ADO</l:value><l:value>System.Data.Design</l:value><l:value>System.Data.Internal</l:value><l:value>System.Data.SQL</l:value><l:value>System.Data.SQLTypes</l:value><l:value>System.Data.XML</l:value><l:value>System.Data.XML.DOM</l:value><l:value>System.Data.XML.XPath</l:value><l:value>System.Data.XML.XSLT</l:value><l:value>System.Diagnostics</l:value><l:value>System.Diagnostics.SymbolStore</l:value><l:value>System.DirectoryServices</l:value><l:value>System.Drawing</l:value><l:value>System.Drawing.Design</l:value><l:value>System.Drawing.Drawing2D</l:value><l:value>System.Drawing.Imaging</l:value><l:value>System.Drawing.Printing</l:value><l:value>System.Drawing.Text</l:value><l:value>System.Globalization</l:value><l:value>System.IO</l:value><l:value>System.IO.IsolatedStorage</l:value><l:value>System.Messaging</l:value><l:value>System.Net</l:value><l:value>System.Net.Sockets</l:value><l:value>System.NewXml</l:value><l:value>System.NewXml.XPath</l:value><l:value>System.NewXml.Xsl</l:value><l:value>System.Reflection</l:value><l:value>System.Reflection.Emit</l:value><l:value>System.Resources</l:value><l:value>System.Runtime.InteropServices</l:value><l:value>System.Runtime.InteropServices.Expando</l:value><l:value>System.Runtime.Remoting</l:value><l:value>System.Runtime.Serialization</l:value><l:value>System.Runtime.Serialization.Formatters</l:value><l:value>System.Runtime.Serialization.Formatters.Binary</l:value><l:value>System.Security</l:value><l:value>System.Security.Cryptography</l:value><l:value>System.Security.Cryptography.X509Certificates</l:value><l:value>System.Security.Permissions</l:value><l:value>System.Security.Policy</l:value><l:value>System.Security.Principal</l:value><l:value>System.ServiceProcess</l:value><l:value>System.Text</l:value><l:value>System.Text.RegularExpressions</l:value><l:value>System.Threading</l:value><l:value>System.Timers</l:value><l:value>System.Web</l:value><l:value>System.Web.Caching</l:value><l:value>System.Web.Configuration</l:value><l:value>System.Web.Security</l:value><l:value>System.Web.Services</l:value><l:value>System.Web.Services.Description</l:value><l:value>System.Web.Services.Discovery</l:value><l:value>System.Web.Services.Protocols</l:value><l:value>System.Web.UI</l:value><l:value>System.Web.UI.Design</l:value><l:value>System.Web.UI.Design.WebControls</l:value><l:value>System.Web.UI.Design.WebControls.ListControls</l:value><l:value>System.Web.UI.HtmlControls</l:value><l:value>System.Web.UI.WebControls</l:value><l:value>System.WinForms</l:value><l:value>System.WinForms.ComponentModel</l:value><l:value>System.WinForms.Design</l:value><l:value>System.Xml</l:value><l:value>System.Xml.Serialization</l:value><l:value>System.Xml.Serialization.Code</l:value><l:value>System.Xml.Serialization.Schema</l:value></l:set></l:keywords><l:regexps></l:regexps><l:styles><l:style element="splitter_1" color="0000FF"/><l:style element="splitter_2" color="0000FF"/><l:style element="comments_1" color="008080" italic="true"/><l:style element="comments_2" color="008080"/><l:style element="symbols_0" color="008000"/><l:style element="keywords_1" color="0600FF"/><l:style element="keywords_2" color="FF8000" bold="true"/><l:style element="keywords_3" color="008000"/><l:style element="keywords_4" color="FF0000"/><l:style element="keywords_5" color="000000"/><l:style element="comment_multi" color="008080" italic="true"/><l:style element="string" color="666666"/><l:style element="number" color="FF0000"/><l:style element="escaped" color="008080" bold="true"/></l:styles></l:language>