<?xml version="1.0" encoding="UTF-8"?>
<l:language xmlns:l="http://cedric.bosdonnat.free.fr/coooder/language/"    xmlns:xsi="http://www.w3.org/2001/XMLSchema-instance"    xsi:schemaLocation="http://cedric.bosdonnat.free.fr/coooder/language/ language.xsd " 	id="xorg_conf" name="Xorg configuration" objectOriented="false" escapeChar="\"><l:comments caseSensitive="false"><l:single id="comments_1"><l:opening>#</l:opening></l:single></l:comments><l:symbols></l:symbols><l:quotemarks><l:value>&quot;</l:value></l:quotemarks><l:keywords><l:set id="keywords_1" caseSensitive="false"><l:value>Section</l:value><l:value>EndSection</l:value><l:value>SubSection</l:value><l:value>EndSubSection</l:value></l:set><l:set id="keywords_2" caseSensitive="false"><l:value>BiosBase</l:value><l:value>Black</l:value><l:value>Boardname</l:value><l:value>BusID</l:value><l:value>ChipID</l:value><l:value>ChipRev</l:value><l:value>Chipset</l:value><l:value>ClockChip</l:value><l:value>Clocks</l:value><l:value>DacSpeed</l:value><l:value>DefaultDepth</l:value><l:value>DefaultFbBpp</l:value><l:value>Depth</l:value><l:value>Device</l:value><l:value>DisplaySize</l:value><l:value>Driver</l:value><l:value>FbBpp</l:value><l:value>Gamma</l:value><l:value>HorizSync</l:value><l:value>IOBase</l:value><l:value>Identifier</l:value><l:value>InputDevice</l:value><l:value>Load</l:value><l:value>MemBase</l:value><l:value>Mode</l:value><l:value>Modeline</l:value><l:value>Modelname</l:value><l:value>Modes</l:value><l:value>Monitor</l:value><l:value>Option</l:value><l:value>Ramdac</l:value><l:value>RgbPath</l:value><l:value>Screen</l:value><l:value>TextClockFreq</l:value><l:value>UseModes</l:value><l:value>VendorName</l:value><l:value>VertRefresh</l:value><l:value>VideoAdaptor</l:value><l:value>VideoRam</l:value><l:value>ViewPort</l:value><l:value>Virtual</l:value><l:value>Visual</l:value><l:value>Weight</l:value><l:value>White</l:value></l:set><l:set id="keywords_3" caseSensitive="false"><l:value>Above</l:value><l:value>Absolute</l:value><l:value>Below</l:value><l:value>LeftOf</l:value><l:value>Relative</l:value><l:value>RightOf</l:value><l:value>DotClock</l:value><l:value>Flags</l:value><l:value>HSkew</l:value><l:value>HTimings</l:value><l:value>VScan</l:value><l:value>VTimings</l:value></l:set></l:keywords><l:regexps></l:regexps><l:styles><l:style element="comments_1" color="adadad" italic="true"/><l:style element="keywords_1" color="b1b100"/><l:style element="keywords_2" color="990000"/><l:style element="keywords_3" color="550000"/><l:style element="string" color="0000ff"/><l:style element="number" color="cc66cc"/></l:styles></l:language>