<?xml version="1.0" encoding="UTF-8"?>
<l:language xmlns:l="http://cedric.bosdonnat.free.fr/coooder/language/"    xmlns:xsi="http://www.w3.org/2001/XMLSchema-instance"    xsi:schemaLocation="http://cedric.bosdonnat.free.fr/coooder/language/ language.xsd " 	id="eiffel" name="Eiffel" objectOriented="true" escapeChar="%"><l:objectSplitters><l:splitter id="splitter_1" value="."/></l:objectSplitters><l:comments caseSensitive="false"><l:single id="comments_1"><l:opening>--</l:opening></l:single></l:comments><l:symbols><l:set id="symbols_0"><l:value>+</l:value><l:value>-</l:value><l:value>*</l:value><l:value>?</l:value><l:value>=</l:value><l:value>/</l:value><l:value>%</l:value><l:value>&amp;</l:value><l:value>&gt;</l:value><l:value>&lt;</l:value><l:value>^</l:value><l:value>!</l:value><l:value>|</l:value><l:value>:</l:value><l:value>(</l:value><l:value>)</l:value><l:value>{</l:value><l:value>}</l:value><l:value>[</l:value><l:value>]</l:value><l:value>#</l:value></l:set></l:symbols><l:quotemarks><l:value>'</l:value><l:value>&quot;</l:value></l:quotemarks><l:keywords><l:set id="keywords_1" caseSensitive="false"><l:value>separate</l:value><l:value>invariant</l:value><l:value>inherit</l:value><l:value>indexing</l:value><l:value>feature</l:value><l:value>expanded</l:value><l:value>deferred</l:value><l:value>class</l:value></l:set><l:set id="keywords_2" caseSensitive="false"><l:value>xor</l:value><l:value>when</l:value><l:value>variant</l:value><l:value>until</l:value><l:value>unique</l:value><l:value>undefine</l:value><l:value>then</l:value><l:value>strip</l:value><l:value>select</l:value><l:value>retry</l:value><l:value>rescue</l:value><l:value>require</l:value><l:value>rename</l:value><l:value>reference</l:value><l:value>redefine</l:value><l:value>prefix</l:value><l:value>or</l:value><l:value>once</l:value><l:value>old</l:value><l:value>obsolete</l:value><l:value>not</l:value><l:value>loop</l:value><l:value>local</l:value><l:value>like</l:value><l:value>is</l:value><l:value>inspect</l:value><l:value>infix</l:value><l:value>include</l:value><l:value>implies</l:value><l:value>if</l:value><l:value>frozen</l:value><l:value>from</l:value><l:value>external</l:value><l:value>export</l:value><l:value>ensure</l:value><l:value>end</l:value><l:value>elseif</l:value><l:value>else</l:value><l:value>do</l:value><l:value>creation</l:value><l:value>create</l:value><l:value>check</l:value><l:value>as</l:value><l:value>and</l:value><l:value>alias</l:value><l:value>agent</l:value></l:set><l:set id="keywords_3" caseSensitive="false"><l:value>Void</l:value><l:value>True</l:value><l:value>Result</l:value><l:value>Precursor</l:value><l:value>False</l:value><l:value>Current</l:value></l:set><l:set id="keywords_4" caseSensitive="false"><l:value>UNIX_SIGNALS</l:value><l:value>UNIX_FILE_INFO</l:value><l:value>UNBOUNDED</l:value><l:value>TWO_WAY_TREE_CURSOR</l:value><l:value>TWO_WAY_TREE</l:value><l:value>TWO_WAY_SORTED_SET</l:value><l:value>TWO_WAY_LIST</l:value><l:value>TWO_WAY_CURSOR_TREE</l:value><l:value>TWO_WAY_CIRCULAR</l:value><l:value>TWO_WAY_CHAIN_ITERATOR</l:value><l:value>TUPLE</l:value><l:value>TREE</l:value><l:value>TRAVERSABLE</l:value><l:value>TO_SPECIAL</l:value><l:value>THREAD_CONTROL</l:value><l:value>THREAD_ATTRIBUTES</l:value><l:value>THREAD</l:value><l:value>TABLE</l:value><l:value>SUBSET</l:value><l:value>STRING_HANDLER</l:value><l:value>STRING</l:value><l:value>STREAM</l:value><l:value>STORABLE</l:value><l:value>STD_FILES</l:value><l:value>STACK</l:value><l:value>SPECIAL</l:value><l:value>SORTED_TWO_WAY_LIST</l:value><l:value>SORTED_STRUCT</l:value><l:value>SORTED_LIST</l:value><l:value>SINGLE_MATH</l:value><l:value>SET</l:value><l:value>SEQUENCE</l:value><l:value>SEQ_STRING</l:value><l:value>SEMAPHORE</l:value><l:value>ROUTINE</l:value><l:value>RESIZABLE</l:value><l:value>RECURSIVE_TREE_CURSOR</l:value><l:value>RECURSIVE_CURSOR_TREE</l:value><l:value>REAL_REF</l:value><l:value>REAL</l:value><l:value>RAW_FILE</l:value><l:value>RANDOM</l:value><l:value>QUEUE</l:value><l:value>PROXY</l:value><l:value>PROFILING_SETTING</l:value><l:value>PROCEDURE</l:value><l:value>PRIORITY_QUEUE</l:value><l:value>PRIMES</l:value><l:value>PRECOMP</l:value><l:value>POINTER_REF</l:value><l:value>POINTER</l:value><l:value>PLATFORM</l:value><l:value>PLAIN_TEXT_FILE</l:value><l:value>PATH_NAME</l:value><l:value>PART_SORTED_TWO_WAY_LIST</l:value><l:value>PART_SORTED_SET</l:value><l:value>PART_SORTED_LIST</l:value><l:value>PART_COMPARABLE</l:value><l:value>OPERATING_ENVIRONMENT</l:value><l:value>ONCE_CONTROL</l:value><l:value>OBJECT_OWNER</l:value><l:value>OBJECT_CONTROL</l:value><l:value>NUMERIC</l:value><l:value>NONE</l:value><l:value>MUTEX</l:value><l:value>MULTI_ARRAY_LIST</l:value><l:value>MULTAR_LIST_CURSOR</l:value><l:value>MEMORY</l:value><l:value>MEM_INFO</l:value><l:value>MEM_CONST</l:value><l:value>MATH_CONST</l:value><l:value>LIST</l:value><l:value>LINKED_TREE_CURSOR</l:value><l:value>LINKED_TREE</l:value><l:value>LINKED_STACK</l:value><l:value>LINKED_SET</l:value><l:value>LINKED_QUEUE</l:value><l:value>LINKED_PRIORITY_QUEUE</l:value><l:value>LINKED_LIST_CURSOR</l:value><l:value>LINKED_LIST</l:value><l:value>LINKED_CURSOR_TREE</l:value><l:value>LINKED_CIRCULAR</l:value><l:value>LINKABLE</l:value><l:value>LINEAR_ITERATOR</l:value><l:value>LINEAR</l:value><l:value>ITERATOR</l:value><l:value>IO_MEDIUM</l:value><l:value>INTERNAL</l:value><l:value>INTEGER_REF</l:value><l:value>INTEGER_INTERVAL</l:value><l:value>INTEGER</l:value><l:value>INFINITE</l:value><l:value>INDEXABLE</l:value><l:value>IDENTIFIED_CONTROLLER</l:value><l:value>IDENTIFIED</l:value><l:value>HIERARCHICAL</l:value><l:value>HEAP_PRIORITY_QUEUE</l:value><l:value>HASHABLE</l:value><l:value>HASH_TABLE_CURSOR</l:value><l:value>HASH_TABLE</l:value><l:value>GENERAL</l:value><l:value>GC_INFO</l:value><l:value>FUNCTION</l:value><l:value>FORMAT_INTEGER</l:value><l:value>FORMAT_DOUBLE</l:value><l:value>FIXED_TREE</l:value><l:value>FIXED_LIST</l:value><l:value>FIXED</l:value><l:value>FINITE</l:value><l:value>FILE_NAME</l:value><l:value>FILE</l:value><l:value>FIBONACCI</l:value><l:value>EXECUTION_ENVIRONMENT</l:value><l:value>EXCEPTIONS</l:value><l:value>EXCEP_CONST</l:value><l:value>DYNAMIC_TREE</l:value><l:value>DYNAMIC_LIST</l:value><l:value>DYNAMIC_CIRCULAR</l:value><l:value>DYNAMIC_CHAIN</l:value><l:value>DOUBLE_REF</l:value><l:value>DOUBLE_MATH</l:value><l:value>DOUBLE</l:value><l:value>DISPENSER</l:value><l:value>DIRECTORY_NAME</l:value><l:value>DIRECTORY</l:value><l:value>DECLARATOR</l:value><l:value>DEBUG_OUTPUT</l:value><l:value>CURSOR_TREE_ITERATOR</l:value><l:value>CURSOR_TREE</l:value><l:value>CURSOR_STRUCTURE</l:value><l:value>CURSOR</l:value><l:value>COUNTABLE_SEQUENCE</l:value><l:value>COUNTABLE</l:value><l:value>CONTAINER</l:value><l:value>CONSOLE</l:value><l:value>CONDITION_VARIABLE</l:value><l:value>COMPARABLE_STRUCT</l:value><l:value>COMPARABLE_SET</l:value><l:value>COMPARABLE</l:value><l:value>COMPACT_TREE_CURSOR</l:value><l:value>COMPACT_CURSOR_TREE</l:value><l:value>COLLECTION</l:value><l:value>CIRCULAR_CURSOR</l:value><l:value>CIRCULAR</l:value><l:value>CHARACTER_REF</l:value><l:value>CHARACTER</l:value><l:value>CHAIN</l:value><l:value>CELL</l:value><l:value>BOX</l:value><l:value>BOUNDED_STACK</l:value><l:value>BOUNDED_QUEUE</l:value><l:value>BOUNDED</l:value><l:value>BOOLEAN_REF</l:value><l:value>BOOLEAN</l:value><l:value>BOOL_STRING</l:value><l:value>BIT_REF</l:value><l:value>BINARY_TREE</l:value><l:value>BINARY_SEARCH_TREE_SET</l:value><l:value>BINARY_SEARCH_TREE</l:value><l:value>BILINEAR</l:value><l:value>BI_LINKABLE</l:value><l:value>BASIC_ROUTINES</l:value><l:value>BAG</l:value><l:value>ASCII</l:value><l:value>ARRAYED_TREE</l:value><l:value>ARRAYED_STACK</l:value><l:value>ARRAYED_QUEUE</l:value><l:value>ARRAYED_LIST_CURSOR</l:value><l:value>ARRAYED_LIST</l:value><l:value>ARRAYED_CIRCULAR</l:value><l:value>ARRAY2</l:value><l:value>ARRAY</l:value><l:value>ARGUMENTS</l:value><l:value>ANY</l:value><l:value>ACTIVE</l:value></l:set><l:set id="keywords_5" caseSensitive="false"><l:value>yes</l:value><l:value>visible</l:value><l:value>trace</l:value><l:value>system</l:value><l:value>root</l:value><l:value>profile</l:value><l:value>override_cluster</l:value><l:value>object</l:value><l:value>no</l:value><l:value>multithreaded</l:value><l:value>msil_generation_type</l:value><l:value>line_generation</l:value><l:value>library</l:value><l:value>inlining_size</l:value><l:value>inlining</l:value><l:value>include_path</l:value><l:value>il_verifiable</l:value><l:value>exclude</l:value><l:value>exception_trace</l:value><l:value>dynamic_runtime</l:value><l:value>dotnet_naming_convention</l:value><l:value>disabled_debug</l:value><l:value>default</l:value><l:value>debug</l:value><l:value>dead_code_removal</l:value><l:value>console_application</l:value><l:value>cluster</l:value><l:value>cls_compliant</l:value><l:value>check_vape</l:value><l:value>assertion</l:value><l:value>array_optimization</l:value><l:value>all</l:value><l:value>address_expression</l:value></l:set></l:keywords><l:regexps></l:regexps><l:styles><l:style element="splitter_1" color="000060"/><l:style element="comments_1" color="008000" italic="true"/><l:style element="symbols_0" color="600000"/><l:style element="keywords_1" color="0600FF" bold="true"/><l:style element="keywords_2" color="0600FF" bold="true"/><l:style element="keywords_3" color="800080"/><l:style element="keywords_4" color="800000"/><l:style element="keywords_5" color="603000"/><l:style element="string" color="0080A0"/><l:style element="number" color="FF0000"/><l:style element="escaped" color="005070" bold="true"/></l:styles></l:language>