<?xml version="1.0" encoding="UTF-8"?>
<l:language xmlns:l="http://cedric.bosdonnat.free.fr/coooder/language/"    xmlns:xsi="http://www.w3.org/2001/XMLSchema-instance"    xsi:schemaLocation="http://cedric.bosdonnat.free.fr/coooder/language/ language.xsd " 	id="cfdg" name="CFDG" objectOriented="false" escapeChar=""><l:comments caseSensitive="false"><l:single id="comments_1"><l:opening>//</l:opening></l:single><l:single id="comments_2"><l:opening>#</l:opening></l:single><l:multiple><l:opening>/*</l:opening><l:closing>*/</l:closing></l:multiple></l:comments><l:symbols><l:set id="symbols_0"><l:value>[</l:value><l:value>]</l:value><l:value>{</l:value><l:value>}</l:value><l:value>*</l:value><l:value>|</l:value></l:set></l:symbols><l:quotemarks><l:value>'</l:value><l:value>&quot;</l:value></l:quotemarks><l:keywords><l:set id="keywords_1" caseSensitive="false"><l:value>include</l:value><l:value>startshape</l:value><l:value>rule</l:value><l:value>background</l:value></l:set><l:set id="keywords_2" caseSensitive="false"><l:value>SQUARE</l:value><l:value>CIRCLE</l:value><l:value>TRIANGLE</l:value></l:set><l:set id="keywords_3" caseSensitive="false"><l:value>b</l:value><l:value>brightness</l:value><l:value>h</l:value><l:value>hue</l:value><l:value>sat</l:value><l:value>saturation</l:value><l:value>a</l:value><l:value>alpha</l:value><l:value>x</l:value><l:value>y</l:value><l:value>z</l:value><l:value>s</l:value><l:value>size</l:value><l:value>r</l:value><l:value>rotate</l:value><l:value>f</l:value><l:value>flip</l:value><l:value>skew</l:value><l:value>xml_set_object</l:value></l:set></l:keywords><l:regexps></l:regexps><l:styles><l:style element="comments_1" color="808080" italic="true"/><l:style element="comments_2" color="808080" italic="true"/><l:style element="symbols_0" color="66cc66"/><l:style element="keywords_1" color="717100"/><l:style element="keywords_2" color="000000" bold="true"/><l:style element="keywords_3" color="006666"/><l:style element="comment_multi" color="808080" italic="true"/><l:style element="string" color="ff0000"/><l:style element="number" color="cc66cc"/><l:style element="escaped" color="000099" bold="true"/></l:styles></l:language>