<?xml version="1.0" encoding="UTF-8"?>
<l:language xmlns:l="http://cedric.bosdonnat.free.fr/coooder/language/"    xmlns:xsi="http://www.w3.org/2001/XMLSchema-instance"    xsi:schemaLocation="http://cedric.bosdonnat.free.fr/coooder/language/ language.xsd " 	id="robots" name="robots.txt" objectOriented="false" escapeChar=""><l:comments caseSensitive="false"><l:single id="comments_1"><l:opening>#</l:opening></l:single></l:comments><l:symbols><l:set id="symbols_0"><l:value>:</l:value></l:set></l:symbols><l:quotemarks></l:quotemarks><l:keywords><l:set id="keywords_1" caseSensitive="false"><l:value>User-agent</l:value><l:value>Disallow</l:value></l:set></l:keywords><l:regexps></l:regexps><l:styles><l:style element="comments_1" color="808080" italic="true"/><l:style element="symbols_0" color="66cc66"/><l:style element="keywords_1" color="b1b100"/><l:style element="string" color="ff0000"/><l:style element="number" color="cc66cc"/><l:style element="escaped" color="000099" bold="true"/></l:styles></l:language>