<?xml version="1.0" encoding="UTF-8"?>
<l:language xmlns:l="http://cedric.bosdonnat.free.fr/coooder/language/"    xmlns:xsi="http://www.w3.org/2001/XMLSchema-instance"    xsi:schemaLocation="http://cedric.bosdonnat.free.fr/coooder/language/ language.xsd " 	id="ocaml" name="OCaml" objectOriented="true" escapeChar=""><l:objectSplitters><l:splitter id="splitter_1" value="."/></l:objectSplitters><l:comments caseSensitive="false"><l:multiple><l:opening>(*</l:opening><l:closing>*)</l:closing></l:multiple></l:comments><l:symbols><l:set id="symbols_0"><l:value>;</l:value><l:value>!</l:value><l:value>:</l:value><l:value>.</l:value><l:value>=</l:value><l:value>%</l:value><l:value>^</l:value><l:value>*</l:value><l:value>-</l:value><l:value>/</l:value><l:value>+</l:value><l:value>&gt;</l:value><l:value>&lt;</l:value><l:value>(</l:value><l:value>)</l:value><l:value>[</l:value><l:value>]</l:value><l:value>&amp;</l:value><l:value>|</l:value><l:value>#</l:value><l:value>'</l:value></l:set></l:symbols><l:quotemarks><l:value>&quot;</l:value></l:quotemarks><l:keywords><l:set id="keywords_1" caseSensitive="false"><l:value>and</l:value><l:value>as</l:value><l:value>asr</l:value><l:value>begin</l:value><l:value>class</l:value><l:value>closed</l:value><l:value>constraint</l:value><l:value>do</l:value><l:value>done</l:value><l:value>downto</l:value><l:value>else</l:value><l:value>end</l:value><l:value>exception</l:value><l:value>external</l:value><l:value>failwith</l:value><l:value>false</l:value><l:value>flush</l:value><l:value>for</l:value><l:value>fun</l:value><l:value>function</l:value><l:value>functor</l:value><l:value>if</l:value><l:value>in</l:value><l:value>include</l:value><l:value>inherit</l:value><l:value>incr</l:value><l:value>land</l:value><l:value>let</l:value><l:value>load</l:value><l:value>los</l:value><l:value>lsl</l:value><l:value>lsr</l:value><l:value>lxor</l:value><l:value>match</l:value><l:value>method</l:value><l:value>mod</l:value><l:value>module</l:value><l:value>mutable</l:value><l:value>new</l:value><l:value>not</l:value><l:value>of</l:value><l:value>open</l:value><l:value>option</l:value><l:value>or</l:value><l:value>parser</l:value><l:value>private</l:value><l:value>ref</l:value><l:value>rec</l:value><l:value>raise</l:value><l:value>regexp</l:value><l:value>sig</l:value><l:value>struct</l:value><l:value>stdout</l:value><l:value>stdin</l:value><l:value>stderr</l:value><l:value>then</l:value><l:value>to</l:value><l:value>true</l:value><l:value>try</l:value><l:value>type</l:value><l:value>val</l:value><l:value>virtual</l:value><l:value>when</l:value><l:value>while</l:value><l:value>with</l:value></l:set><l:set id="keywords_2" caseSensitive="false"><l:value>Arg</l:value><l:value>Arith_status</l:value><l:value>Array</l:value><l:value>ArrayLabels</l:value><l:value>Big_int</l:value><l:value>Bigarray</l:value><l:value>Buffer</l:value><l:value>Callback</l:value><l:value>CamlinternalOO</l:value><l:value>Char</l:value><l:value>Complex</l:value><l:value>Condition</l:value><l:value>Dbm</l:value><l:value>Digest</l:value><l:value>Dynlink</l:value><l:value>Event</l:value><l:value>Filename</l:value><l:value>Format</l:value><l:value>Gc</l:value><l:value>Genlex</l:value><l:value>Graphics</l:value><l:value>GraphicsX11</l:value><l:value>Hashtbl</l:value><l:value>Int32</l:value><l:value>Int64</l:value><l:value>Lazy</l:value><l:value>Lexing</l:value><l:value>List</l:value><l:value>ListLabels</l:value><l:value>Map</l:value><l:value>Marshal</l:value><l:value>MoreLabels</l:value><l:value>Mutex</l:value><l:value>Nativeint</l:value><l:value>Num</l:value><l:value>Obj</l:value><l:value>Oo</l:value><l:value>Parsing</l:value><l:value>Pervasives</l:value><l:value>Printexc</l:value><l:value>Printf</l:value><l:value>Queue</l:value><l:value>Random</l:value><l:value>Scanf</l:value><l:value>Set</l:value><l:value>Sort</l:value><l:value>Stack</l:value><l:value>StdLabels</l:value><l:value>Str</l:value><l:value>Stream</l:value><l:value>String</l:value><l:value>StringLabels</l:value><l:value>Sys</l:value><l:value>Thread</l:value><l:value>ThreadUnix</l:value><l:value>Tk</l:value></l:set><l:set id="keywords_3" caseSensitive="false"><l:value>raise</l:value><l:value>invalid_arg</l:value><l:value>failwith</l:value><l:value>compare</l:value><l:value>min</l:value><l:value>max</l:value><l:value>succ</l:value><l:value>pred</l:value><l:value>mod</l:value><l:value>abs</l:value><l:value>max_int</l:value><l:value>min_int</l:value><l:value>sqrt</l:value><l:value>exp</l:value><l:value>log</l:value><l:value>log10</l:value><l:value>cos</l:value><l:value>sin</l:value><l:value>tan</l:value><l:value>acos</l:value><l:value>asin</l:value><l:value>atan</l:value><l:value>atan2</l:value><l:value>cosh</l:value><l:value>sinh</l:value><l:value>tanh</l:value><l:value>ceil</l:value><l:value>floor</l:value><l:value>abs_float</l:value><l:value>mod_float</l:value><l:value>frexp</l:value><l:value>ldexp</l:value><l:value>modf</l:value><l:value>float</l:value><l:value>float_of_int</l:value><l:value>truncate</l:value><l:value>int_of_float</l:value><l:value>infinity</l:value><l:value>nan</l:value><l:value>max_float</l:value><l:value>min_float</l:value><l:value>epsilon_float</l:value><l:value>classify_float</l:value><l:value>int_of_char</l:value><l:value>char_of_int</l:value><l:value>ignore</l:value><l:value>string_of_bool</l:value><l:value>bool_of_string</l:value><l:value>string_of_int</l:value><l:value>int_of_string</l:value><l:value>string_of_float</l:value><l:value>float_of_string</l:value><l:value>fst</l:value><l:value>snd</l:value><l:value>stdin</l:value><l:value>stdout</l:value><l:value>stderr</l:value><l:value>print_char</l:value><l:value>print_string</l:value><l:value>print_int</l:value><l:value>print_float</l:value><l:value>print_endline</l:value><l:value>print_newline</l:value><l:value>prerr_char</l:value><l:value>prerr_string</l:value><l:value>prerr_int</l:value><l:value>prerr_float</l:value><l:value>prerr_endline</l:value><l:value>prerr_newline</l:value><l:value>read_line</l:value><l:value>read_int</l:value><l:value>read_float</l:value><l:value>open_out</l:value><l:value>open_out_bin</l:value><l:value>open_out_gen</l:value><l:value>flush</l:value><l:value>flush_all</l:value><l:value>output_char</l:value><l:value>output_string</l:value><l:value>output</l:value><l:value>output_byte</l:value><l:value>output_binary_int</l:value><l:value>output_value</l:value><l:value>seek_out</l:value><l:value>pos_out</l:value><l:value>out_channel_length</l:value><l:value>close_out</l:value><l:value>close_out_noerr</l:value><l:value>set_binary_mode_out</l:value><l:value>open_in</l:value><l:value>open_in_bin</l:value><l:value>open_in_gen</l:value><l:value>input_char</l:value><l:value>input_line</l:value><l:value>input</l:value><l:value>really_input</l:value><l:value>input_byte</l:value><l:value>input_binary_int</l:value><l:value>input_value</l:value><l:value>seek_in</l:value><l:value>pos_in</l:value><l:value>in_channel_length</l:value><l:value>close_in</l:value><l:value>close_in_noerr</l:value><l:value>set_binary_mode_in</l:value><l:value>incr</l:value><l:value>decr</l:value><l:value>string_of_format</l:value><l:value>format_of_string</l:value><l:value>exit</l:value><l:value>at_exit</l:value></l:set><l:set id="keywords_4" caseSensitive="false"><l:value>fpclass</l:value><l:value>in_channel</l:value><l:value>out_channel</l:value><l:value>open_flag</l:value><l:value>Sys_error</l:value><l:value>ref</l:value><l:value>format</l:value></l:set><l:set id="keywords_5" caseSensitive="false"><l:value>Exit</l:value><l:value>Invalid_Argument</l:value><l:value>Failure</l:value><l:value>Division_by_zero</l:value></l:set></l:keywords><l:regexps></l:regexps><l:styles><l:style element="splitter_1" color="060"/><l:style element="symbols_0" color="a52a2a"/><l:style element="keywords_1" color="06c" bold="true"/><l:style element="keywords_2" color="06c" bold="true"/><l:style element="keywords_3" color="06c" bold="true"/><l:style element="keywords_4" color="06c" bold="true"/><l:style element="keywords_5" color="06c" bold="true"/><l:style element="comment_multi" color="5d478b" italic="true"/><l:style element="string" color="3cb371"/><l:style element="number" color="c6c"/></l:styles></l:language>